<?xml version="1.0" encoding="UTF-8"?>
<!DOCTYPE Company SYSTEM "05.dtd">
<!--
Descripción:
Autor: Ismael Ferreras García
Fecha creación/modificación: 17/01/2023
-->
<Company>
	<Employee>
		<FirstName>
			Sanchez
		</FirstName>
		<LastName>
			Juan
		</LastName>
		<ContactNo>
			123456789
		</ContactNo>
		<Email>
			juansanchez@company.com
		</Email>
		<Address>
			<City>
				Bangalore
			</City>
			<State>
				Karnataka
			</State>
			<Zip>
				560212
			</Zip>
		</Address>
	</Employee>
</Company>
