<?xml version="1.0" encoding="UTF-8"?>
<!--
	Autor: Erika Martínez Pérez
    Práctica: Actividad 5
    Descripción: Escribir un documento XML que represente la estructura y almacene la siguiente información: Juan Sanchez, telefono de contacto 
                123456789 con email juansanchez@company.com que vive en Bangalore, estado Karnataka con código 560212
-->
<!DOCTYPE Company SYSTEM "05.dtd">
<Company>
    <Employee>
        <Firtsname>Juan</Firtsname>
        <Lastname>Sanches</Lastname>
        <ContactNo>123456789</ContactNo>
        <Email>juansanchez@company.com</Email>
        <Address>
            <City>Bangalore</City>
            <State>Karnataka</State>
            <Zip>560212</Zip>
        </Address>
    </Employee>
</Company>